{
  "$schema": "https://json-schema.org/draft/2020-12/schema",
  "$id": "https://github.com/SensoriaCity/sensoria-plugins/plugins/city/city.schema.json",
  "title": ".city.json",
  "description": "Contrato entre el plugin city y cada repo. El kit no sabe nada del stack: todo lo que ejecuta o lee sale de aquí. Va en la raíz del repo.",
  "type": "object",
  "additionalProperties": false,
  "required": ["app", "tests", "tope_lineas", "qa", "features", "evidencia_dir", "adr_dir", "ramas", "label", "codeowners_paths"],
  "properties": {
    "app": {
      "type": "string",
      "description": "Nombre corto del repo; va en las ramas y en los reportes. Ejemplo: city, city-v2.",
      "pattern": "^[a-z0-9][a-z0-9-]*$"
    },
    "tests": {
      "type": "object",
      "description": "Comandos que corren build, revisor y evaluador, desde la raíz del repo. Cada uno es una lista: un comando por paquete o superficie. La lista vacía significa que el repo no tiene ese tipo de prueba.",
      "additionalProperties": false,
      "required": ["unit", "navegador", "lint", "estatico", "audit"],
      "properties": {
        "unit": { "$ref": "#/$defs/comandos", "description": "Pruebas unitarias e integración (Pest, Vitest, bash)." },
        "navegador": { "$ref": "#/$defs/comandos", "description": "Pruebas de punta a punta en navegador (Playwright). Vacío si el evaluador es la única prueba de navegador." },
        "lint": { "$ref": "#/$defs/comandos", "description": "Formato y lint (Pint, ESLint, ShellCheck)." },
        "estatico": { "$ref": "#/$defs/comandos", "description": "Análisis estático y tipos (Semgrep, tsc, PHPStan)." },
        "audit": { "$ref": "#/$defs/comandos", "description": "Auditoría de dependencias (composer audit, pnpm audit)." },
        "postgres": { "type": "string", "minLength": 1, "description": "Opcional. Receta para las pruebas que exigen una base desechable: un comando que levanta la base fuera de la instalación, migra, corre esas pruebas y borra la base. Recibe al final los argumentos del runner para acotar a una prueba (p. ej. --filter). El evaluador la usa para las cláusulas \"con su prueba en <grupo o suite>\" que la necesitan." }
      }
    },
    "tope_lineas": {
      "type": "integer",
      "minimum": 1,
      "description": "Tamaño máximo del diff de un corte, en líneas. scripts/tamano.sh lo lee; build, ship y revisor lo aplican."
    },
    "qa": {
      "type": "object",
      "description": "Instalación local limpia donde el evaluador prueba como usuario. url, instalar y puerto pueden nombrar variables del entorno como ${VAR} o ${VAR:-valor}. En el lab, goal.sh toma un slot N de 1 a 3 y exporta a sus sesiones CITY_SLOT=N, CITY_HTTP_PORT=808N, CITY_MAILPIT_PORT=802(5+N) y CITY_BASE_DOMAIN=sN.city.localhost; sin slot (una sesión a mano) no existen y vale lo que va después de :-. instalar lo expande la shell; url y puerto, scripts/qa.py, que no ejecuta nada más.",
      "additionalProperties": false,
      "required": ["url", "instalar", "smoke"],
      "dependentRequired": { "usuario": ["usuario_stdin"], "usuario_stdin": ["usuario"] },
      "properties": {
        "url": { "type": "string", "minLength": 1, "description": "URL base de la app en la instalación local, con el puerto de la instalación: localhost, 127.0.0.1, *.localhost o *.test que resuelve solo a 127.0.0.1. Con slots, nombra sus variables, p. ej. http://app.${CITY_BASE_DOMAIN:-city.localhost}:${CITY_HTTP_PORT:-8080}. build la expande con scripts/qa.py url y el evaluador la confirma con scripts/entorno-qa.py antes de tocar nada." },
        "instalar": { "type": "string", "minLength": 1, "description": "Comando que levanta la instalación desde cero, con sus variables de entorno. Con slots, el puerto va como CITY_HTTP_PORT=${CITY_HTTP_PORT:-8080}: un valor fijo contradice al slot." },
        "smoke": { "type": "string", "minLength": 1, "description": "Comando que verifica la instalación antes de que el evaluador empiece." },
        "bajar": { "type": "string", "minLength": 1, "description": "Opcional. Comando que baja la instalación y sus volúmenes desde la raíz del worktree, solo la de su slot (recibe CITY_SLOT). goal.sh lo corre al terminar cada id; sin él, docker compose --profile onprem down -v --remove-orphans, y solo si el .env del worktree trae COMPOSE_PROJECT_NAME: sin él, Compose bajaría el proyecto por omisión, que puede ser de otro slot o de la sesión a mano." },
        "puerto": {
          "description": "Puerto HTTP de la instalación, cuando difiere del de producción (Herd ocupa 80 y 443): un número, o con slots la variable con su valor sin slot, como \"${CITY_HTTP_PORT:-8080}\". scripts/qa.py lo agrega a url si esta no trae puerto.",
          "oneOf": [
            { "type": "integer", "minimum": 1, "maximum": 65535 },
            { "type": "string", "pattern": "^\\$\\{[A-Za-z_][A-Za-z0-9_]*:-[0-9]{1,5}\\}$" }
          ]
        },
        "usuario": { "type": "string", "minLength": 1, "description": "Opcional. Comando que crea el usuario de prueba en la instalación leyendo sus datos de la entrada estándar, una línea por elemento de usuario_stdin. build lo corre después de instalar y le pasa al evaluador correo y contraseña." },
        "usuario_stdin": {
          "type": "array",
          "minItems": 1,
          "items": { "enum": ["correo", "nombre", "contraseña"] },
          "description": "Opcional; va con usuario. Qué línea espera el comando, en orden: correo (qa+<fecha>@city.localhost), nombre (QA) o contraseña (aleatoria, de 20 caracteres). Repite un elemento si el comando pide confirmarlo."
        }
      }
    },
    "features": {
      "type": "string",
      "minLength": 1,
      "not": { "pattern": "\\.json$" },
      "description": "Carpeta de funcionalidades: un archivo <id>.json por funcionalidad, con sus pasos verificables y passes, para que dos ramas no toquen el mismo archivo. passes solo cambia con scripts/passes.sh, que exige la evidencia del evaluador con VEREDICTO: pasa."
    },
    "specs_dir": {
      "type": "string",
      "minLength": 1,
      "description": "Opcional. Carpeta donde /city:spec escribe las specs de una página; sin él, docs/specs. Cada funcionalidad que sale de una spec lleva su ruta en la clave spec."
    },
    "evidencia_dir": {
      "type": "string",
      "minLength": 1,
      "description": "Carpeta donde el evaluador deja capturas y reportes por funcionalidad."
    },
    "adr_dir": {
      "type": "string",
      "minLength": 1,
      "description": "Carpeta de los ADR. necesita-adr.php y /city:adr escriben aquí."
    },
    "ramas": {
      "type": "string",
      "pattern": "^[a-z0-9-]+/$",
      "description": "Prefijo de las ramas que abre build, con barra final. El token de gh solo puede hacer push a este prefijo y a los Conventional que acepta ship (docs/ para las specs de /city:spec)."
    },
    "label": {
      "type": "string",
      "minLength": 1,
      "description": "Label que ship pone en cada PR; firma del flujo para aidd-metrics."
    },
    "git": {
      "type": "object",
      "description": "Opcional. Convenciones de git del repo, detalladas en skills/ship/git.md. Sin la clave o sin un campo, vale el de por omisión.",
      "additionalProperties": false,
      "properties": {
        "commits": { "enum": ["conventional", "gitmoji"], "description": "Formato de los commits y del título del PR. conventional (por omisión): <tipo>(<ámbito>): <qué cambia>. gitmoji: <emoji> <frase que dice qué cambia>." },
        "merge": { "enum": ["auto", "manual"], "description": "auto (por omisión): ship activa el auto-merge por squash. manual: el PR lo aprueba y lo mergea una persona; ship no activa el auto-merge y goal no corre." },
        "version": { "enum": ["tag", "asunto"], "description": "Dónde queda la versión de cada merge, para check. tag (por omisión): un tag sobre el commit del merge. asunto: el asunto del commit del squash." }
      }
    },
    "codeowners_paths": {
      "type": "array",
      "minItems": 1,
      "uniqueItems": true,
      "items": { "type": "string", "minLength": 1 },
      "description": "Patrones de CODEOWNERS que retienen el PR para lectura humana. ship avisa cuando el diff toca uno; /city:goal para si hay más de tres PR retenidos."
    },
    "revisor_extra": {
      "type": "string",
      "minLength": 1,
      "description": "Opcional. Archivo del repo con los chequeos propios del stack que el agente revisor aplica después de los generales, con la severidad que el archivo les dé."
    },
    "seguridad_checklist": {
      "type": "string",
      "minLength": 1,
      "description": "Opcional. Checklist de seguridad del repo. El agente seguridad lo recorre sobre los archivos del diff y el revisor lo usa en su paso de seguridad; sin él, ambos usan sus categorías."
    }
  },
  "$defs": {
    "comandos": {
      "type": "array",
      "items": { "type": "string", "minLength": 1 }
    }
  }
}
